{
  "schema_version": "1.0.0",
  "id": "model-result-privacy-blocked-001",
  "request_id": "model-request-remote-pii-invalid",
  "status": "privacy_blocked",
  "provider": {
    "provider_id": null,
    "mode": "none",
    "remote": false,
    "config_version": null
  },
  "model": {
    "name": null,
    "version": null,
    "capability": "none"
  },
  "output": {
    "kind": "none",
    "content": null,
    "structured": null,
    "output_refs": []
  },
  "usage": {
    "input_tokens": 0,
    "output_tokens": 0,
    "total_tokens": 0,
    "cost_usd": 0,
    "currency": "none"
  },
  "latency": {
    "started_at": "2026-06-29T16:08:00+08:00",
    "completed_at": "2026-06-29T16:08:00+08:00",
    "elapsed_ms": 0,
    "timed_out": false
  },
  "error": {
    "code": "privacy_blocked",
    "message": "隐私策略阻止远程模型调用。",
    "retryable": false
  },
  "safety": {
    "blocked": true,
    "categories": ["privacy"],
    "redaction_applied": false,
    "output_truncated": false
  },
  "created_at": "2026-06-29T16:08:00+08:00"
}
